<?xml version="1.0" encoding="UTF-8"?>
<!--

       Copyright 2006-2016 the original author or authors.

       Licensed under the Apache License, Version 2.0 (the "License");
       you may not use this file except in compliance with the License.
       You may obtain a copy of the License at

          http://www.apache.org/licenses/LICENSE-2.0

       Unless required by applicable law or agreed to in writing, software
       distributed under the License is distributed on an "AS IS" BASIS,
       WITHOUT WARRANTIES OR CONDITIONS OF ANY KIND, either express or implied.
       See the License for the specific language governing permissions and
       limitations under the License.

-->
<!DOCTYPE generatorConfiguration PUBLIC
 "-//mybatis.org//DTD MyBatis Generator Configuration 1.0//EN"
 "http://mybatis.org/dtd/mybatis-generator-config_1_0.dtd">

<generatorConfiguration>
  <!-- This should cause an error because sqlMapGenerator is required
       if there is no javaClientGenerator -->
  <context id="MyBatis3NoClient" targetRuntime="MyBatis3" defaultModelType="flat">
    <plugin type="org.mybatis.generator.plugins.EqualsHashCodePlugin" />

    <jdbcConnection driverClass="org.hsqldb.jdbcDriver"
        connectionURL="jdbc:hsqldb:mem:aname"
        userId="sa" />

    <javaModelGenerator targetPackage="ibatortest.generated.flat.java5.model"
        targetProject="target/generated-sources/mybatis-generator/mybatis3">
      <property name="enableSubPackages" value="true" />
      <property name="trimStrings" value="true" />
    </javaModelGenerator>

    <table tableName="FieldsOnly" />
    <table tableName="PKOnly" />
    <table tableName="PKFields" alias="B" />
    <table tableName="PKBlobs" />
    <table tableName="PKFieldsBlobs" />
    <table tableName="FieldsBlobs" />
    <table tableName="awful table" alias="A">
      <property name="useColumnIndexes" value="true"/>
      <generatedKey column="CuStOmEr iD" sqlStatement="JDBC" />
      <columnOverride column="first name" property="firstFirstName" />
      <columnOverride column="first_name" property="secondFirstName" />
      <columnOverride column="firstName" property="thirdFirstName" />
      <columnOverride column="from" delimitedColumnName="true" >
        <property name="fredswife" value="wilma"/>
      </columnOverride>
      <columnOverride column="active" javaType="boolean" />
    </table>
  </context>

  <!-- This should cause an error because sqlMapGenerator is required
       for the XMLMAPPER client -->
  <context id="MyBatis3XMLMapper" targetRuntime="MyBatis3" defaultModelType="flat">
    <plugin type="org.mybatis.generator.plugins.EqualsHashCodePlugin" />

    <jdbcConnection driverClass="org.hsqldb.jdbcDriver"
        connectionURL="jdbc:hsqldb:mem:aname"
        userId="sa" />

    <javaModelGenerator targetPackage="ibatortest.generated.flat.java5.model"
        targetProject="target/generated-sources/mybatis-generator/mybatis3">
      <property name="enableSubPackages" value="true" />
      <property name="trimStrings" value="true" />
    </javaModelGenerator>
    
    <javaClientGenerator type="XMLMAPPER" targetPackage="ibatortest.generated.flat.java5.client"
     	targetProject="target/generated-sources/mybatis-generator/mybatis3">
    </javaClientGenerator>

    <table tableName="FieldsOnly" />
    <table tableName="PKOnly" />
    <table tableName="PKFields" alias="B" />
    <table tableName="PKBlobs" />
    <table tableName="PKFieldsBlobs" />
    <table tableName="FieldsBlobs" />
    <table tableName="awful table" alias="A">
      <property name="useColumnIndexes" value="true"/>
      <generatedKey column="CuStOmEr iD" sqlStatement="JDBC" />
      <columnOverride column="first name" property="firstFirstName" />
      <columnOverride column="first_name" property="secondFirstName" />
      <columnOverride column="firstName" property="thirdFirstName" />
      <columnOverride column="from" delimitedColumnName="true" >
        <property name="fredswife" value="wilma"/>
      </columnOverride>
      <columnOverride column="active" javaType="boolean" />
    </table>
  </context>

  <!-- This should cause an error because sqlMapGenerator is required
       for the MIXEDMAPPER client -->
  <context id="MyBatis3MixedMapper" targetRuntime="MyBatis3" defaultModelType="flat">
    <plugin type="org.mybatis.generator.plugins.EqualsHashCodePlugin" />

    <jdbcConnection driverClass="org.hsqldb.jdbcDriver"
        connectionURL="jdbc:hsqldb:mem:aname"
        userId="sa" />

    <javaModelGenerator targetPackage="ibatortest.generated.flat.java5.model"
        targetProject="target/generated-sources/mybatis-generator/mybatis3">
      <property name="enableSubPackages" value="true" />
      <property name="trimStrings" value="true" />
    </javaModelGenerator>
    
    <javaClientGenerator type="MIXEDMAPPER" targetPackage="ibatortest.generated.flat.java5.client"
     	targetProject="target/generated-sources/mybatis-generator/mybatis3">
    </javaClientGenerator>

    <table tableName="FieldsOnly" />
    <table tableName="PKOnly" />
    <table tableName="PKFields" alias="B" />
    <table tableName="PKBlobs" />
    <table tableName="PKFieldsBlobs" />
    <table tableName="FieldsBlobs" />
    <table tableName="awful table" alias="A">
      <property name="useColumnIndexes" value="true"/>
      <generatedKey column="CuStOmEr iD" sqlStatement="JDBC" />
      <columnOverride column="first name" property="firstFirstName" />
      <columnOverride column="first_name" property="secondFirstName" />
      <columnOverride column="firstName" property="thirdFirstName" />
      <columnOverride column="from" delimitedColumnName="true" >
        <property name="fredswife" value="wilma"/>
      </columnOverride>
      <columnOverride column="active" javaType="boolean" />
    </table>
  </context>

  <!-- This should not cause an error because sqlMapGenerator is not required
       for the ANNOTATEDMAPPER client -->
  <context id="MyBatis3AnnotatedMapper" targetRuntime="MyBatis3" defaultModelType="flat">
    <plugin type="org.mybatis.generator.plugins.EqualsHashCodePlugin" />

    <jdbcConnection driverClass="org.hsqldb.jdbcDriver"
        connectionURL="jdbc:hsqldb:mem:aname"
        userId="sa" />

    <javaModelGenerator targetPackage="ibatortest.generated.flat.java5.model"
        targetProject="target/generated-sources/mybatis-generator/mybatis3">
      <property name="enableSubPackages" value="true" />
      <property name="trimStrings" value="true" />
    </javaModelGenerator>
    
    <javaClientGenerator type="ANNOTATEDMAPPER" targetPackage="ibatortest.generated.flat.java5.client"
     	targetProject="target/generated-sources/mybatis-generator/mybatis3">
    </javaClientGenerator>

    <table tableName="FieldsOnly" />
    <table tableName="PKOnly" />
    <table tableName="PKFields" alias="B" />
    <table tableName="PKBlobs" />
    <table tableName="PKFieldsBlobs" />
    <table tableName="FieldsBlobs" />
    <table tableName="awful table" alias="A">
      <property name="useColumnIndexes" value="true"/>
      <generatedKey column="CuStOmEr iD" sqlStatement="JDBC" />
      <columnOverride column="first name" property="firstFirstName" />
      <columnOverride column="first_name" property="secondFirstName" />
      <columnOverride column="firstName" property="thirdFirstName" />
      <columnOverride column="from" delimitedColumnName="true" >
        <property name="fredswife" value="wilma"/>
      </columnOverride>
      <columnOverride column="active" javaType="boolean" />
    </table>
  </context>
</generatorConfiguration>
