<?xml version="1.0" encoding="UTF-8" ?>
<!--

       Copyright 2006-2023 the original author or authors.

       Licensed under the Apache License, Version 2.0 (the "License");
       you may not use this file except in compliance with the License.
       You may obtain a copy of the License at

          https://www.apache.org/licenses/LICENSE-2.0

       Unless required by applicable law or agreed to in writing, software
       distributed under the License is distributed on an "AS IS" BASIS,
       WITHOUT WARRANTIES OR CONDITIONS OF ANY KIND, either express or implied.
       See the License for the specific language governing permissions and
       limitations under the License.


-->
<!DOCTYPE generatorConfiguration
  PUBLIC "-//mybatis.org//DTD MyBatis Generator Configuration 1.0//EN"
  "http://mybatis.org/dtd/mybatis-generator-config_1_0.dtd" >
<generatorConfiguration>
  <context id="context1" targetRuntime="MyBatis3Simple" >
    <jdbcConnection driverClass="org.hsqldb.jdbcDriver"
      connectionURL="${jdbcUrl}"
      userId="sa" >
    </jdbcConnection>
    <javaModelGenerator targetPackage="gen.model" targetProject="MBGTest" >
        <!--
        <property name="rootClass" value="base.BaseModel" />
        --> 
    </javaModelGenerator>
    <sqlMapGenerator targetPackage="gen.mapper" targetProject="MBGTest" />
    <javaClientGenerator targetPackage="gen.mapper" targetProject="MBGTest" type="XMLMAPPER" />
    <table tableName="a" />
  </context>

  <context id="context2" targetRuntime="MyBatis3Simple" >
    <commentGenerator>
      <property name="suppressAllComments" value="false"/>
    </commentGenerator>
    
    <connectionFactory type="DEFAULT" >
        <property name="driverClass" value="org.hsqldb.jdbcDriver" />
        <property name="connectionURL" value="jdbc:hsqldb:mem:aname" />
        <property name="userId" value="sa" />
    </connectionFactory>
    <javaModelGenerator targetPackage="gen.src.model" targetProject="MBGTest/generatedsrc" />
    <sqlMapGenerator targetPackage="gen.src.mapper" targetProject="MBGTest/generatedsrc" />
    <javaClientGenerator targetPackage="gen.src.mapper" targetProject="MBGTest/generatedsrc" type="XMLMAPPER" />
    <table schema="mbgtest" tableName="%" />
  </context>
</generatorConfiguration>
